title,normalized_title,id,create_time,update_time,normalized_time,normtimename,source_part,part_source,mapping_entries,turns,first_preview,last_preview,status,has_user_messages,has_assistant_messages,total_messages,exchanges
Chat history access explanation,chat_history_access_explanation,68f6176a-5e18-8323-be30-473dde6a9107,1760958335.691757,1761072338.619785,1761015337.155771,This_is_normalized.1355.211025,part_4.json,4,50,18,"You know the file, all the chats or whatever, they're like, I'm seeing it on my browser, like all th",ipt for Windows** (PowerShell commands) that you can run. Would you like me to pull those links now?,success,True,True,40,18
Recovery phase completion steps,recovery_phase_completion_steps,68f7d2df-a058-8324-a065-cd0453db38e2,1761071845.199674,1761072269.35136,1761072057.275517,This_is_normalized.0540.221025,part_4.json,4,24,7,I'm distracted from the fact that I need to do this reformat on this like this user I was like it's,").

Would you like me to add that reporting function next (runs immediately after the linkage step)?",success,True,True,19,7
Backup merge plan,backup_merge_plan,68f76aa6-f70c-8320-a078-c5fbae67e0a3,1761045211.65669,1761071688.16161,1761058449.90915,This_is_normalized.0154.221025,part_4.json,4,54,15,"Okay, one last thing. This whole started with making sure there's enough room for the backups on my","logged or updated there when we continue.  

Mission status: **Reinstall Plan finalized and saved.**",success,True,True,42,15
Resuming conversation,resuming_conversation,68f75e3f-a6b8-8322-8263-a4fdb8a62ef5,1761041984.578278,1761071492.921511,1761056738.7498946,This_is_normalized.0125.221025,part_4.json,4,146,48,resume,"uplicates by **size** (even if hash differs).

Would you like me to generate that duplicate summary?",success,True,True,131,48
Anime tracking list analysis,anime_tracking_list_analysis,68f78850-40c8-8322-b263-068d72dd7191,1761052769.061574,1761069283.442944,1761061026.252259,This_is_normalized.0237.221025,part_4.json,4,251,96,My Friend's Little Sister Has It In for Me!	Tomodachi no Imouto ga Ore ni dake Uzai		0	CURRENT		curr,th the **Comic_Master_Index data structure setup** unless you’d rather move to another canvas first.,success,True,True,219,96
Anime media sheet,anime_media_sheet,68f7b854-5ddc-8322-b85a-786ef50ccfb7,1761065045.137395,1761065051.349222,1761065048.2433085,This_is_normalized.0344.221025,part_4.json,4,8,1,Sheet,Media Sheet** document is ready. What would you like to add or pull from the Google Sheet into this?,success,True,True,4,1
Account recovery steps,account_recovery_steps,68f62dec-d1b8-8323-a901-7ab15a3beae7,1760964077.729544,1761064984.222238,1761014530.975891,This_is_normalized.1342.211025,part_4.json,4,182,68,im back,en run the hash-dup scan. Paste back the short output from step 1 & 2 and I’ll guide the next moves.,success,True,True,147,68
Reformat laptop guide,reformat_laptop_guide,68f4defd-5398-8324-ac6b-23f803fe0e8a,1760878348.69526,1761064896.934641,1760971622.8149505,This_is_normalized.0147.211025,part_4.json,4,36,7,Get me my step by step for reformatting my laptip,me to write a quick “morning checklist” for when you wake up (starting from the first setup screen)?,success,True,True,18,7
File processing and ETA,file_processing_and_eta,68f7ae09-b468-8324-ae11-41d932a1600d,1761062412.955919,1761062526.104481,1761062469.5302,This_is_normalized.0301.221025,part_4.json,4,9,3,"Are you still working on our file? I'm just confused whether I need to keep the window open or not,",Would you like me to auto-create a canvas next time we start a major file or data task like this?,success,True,True,6,3
WizTree file path export,wiztree_file_path_export,68f73fa9-dff4-8324-af22-f2023bc37253,1761034168.043909,1761041958.485077,1761038063.264493,This_is_normalized.2014.211025,part_4.json,4,170,61,"Got it — you’re in **WizTree**, and you’ve right-clicked a folder in the tree view.  

If your goal","EADME/final pairs overlap.  
3. Decide whether we move to the cleanup or archive-rewrite phase next.",success,True,True,143,61
Data request for Gemini,data_request_for_gemini,68f72b5a-62f0-8322-ac44-05e4a80c8d07,1761028955.490274,1761029242.261152,1761029098.8757129,This_is_normalized.1744.211025,part_4.json,4,22,3,can you please try and understand from ths input take my last request of gemini as what i want from,me know you’re **back** and I’ll resume exactly from this recovery phase without reloading context.,success,True,True,14,3
PowerShell script analysis,powershell_script_analysis,68f6dc2d-b03c-8323-9daa-cc7b954a28e1,1761008717.49599,1761009100.085549,1761008908.7907696,This_is_normalized.1208.211025,part_4.json,4,15,6,"# Requires the 7-Zip command line tool (7z.exe or 7za.exe) to be installed.
# If 7z.exe is not in y","on will run cleanly and list all internal files with `""final""` in the name from your `.cb7` archive.",success,True,True,12,6
Random prefix folder naming,random_prefix_folder_naming,68f6d13f-d634-8323-8f9e-a9d6213505ef,1761005931.570394,1761005975.275385,1761005953.4228895,This_is_normalized.1119.211025,part_4.json,4,7,2,"Are they ready to go? Are they going to make a four-digit or prefix, a random prefix, onto every fol",accordingly so you can run them immediately. Confirm “yes” or tell me if any of that should change.,success,True,True,4,2
Check folder duplicates,check_folder_duplicates,68f662d7-76e4-8321-bfd9-550d49a9b16e,1760977655.588596,1760981036.098065,1760979345.8433304,This_is_normalized.0355.211025,part_4.json,4,178,55,"""C:\backup stuff\DLs"" ""C:\Backup_Final\DLs"" seem to have duplicates is this true or are they just sp",you like me to go ahead and handle this duplicate or perform any further tasks related to the list?,success,True,True,151,55
Clean backup files,clean_backup_files,68f64980-dfcc-8320-ab31-8d1368ffd190,1760971138.08778,1760977749.594222,1760974443.841001,This_is_normalized.0234.211025,part_4.json,4,381,84,my browser crashed  as u gave me a summary this is the last i sent u i think we wanted to clean all,"ps, or do you need me to investigate something specific? Let me know how you’d like to move forward!",success,True,True,349,84
Reconstructing conversation steps,reconstructing_conversation_steps,68f60cf8-f4f4-8322-a5f2-e90a970307bf,1760955642.898182,1760955651.825448,1760955647.361815,This_is_normalized.2120.201025,part_4.json,4,5,1,The other tab that I was talking to you in is like frozen as far as I can see. Can you see the other,"from there.  

Do you remember what the last message from me said or what you were about to do next?",success,True,True,2,1
Locked out troubleshooting help,locked_out_troubleshooting_help,68f5e785-cb7c-8323-8e6d-795f0b39faf0,1760946076.446138,1760953740.704708,1760949908.575423,This_is_normalized.1945.201025,part_4.json,4,125,36,You have given me a terrible experience. Not only about like all this stuff going wrong and going ba,"wing how prompts, logs, and responses move between the different AIs and your local PowerShell node?",success,True,True,86,36
Resume or start new,resume_or_start_new,68f5bab8-3290-8320-8847-09956d2c32ea,1760934585.575824,1760943026.230135,1760938805.9029794,This_is_normalized.1640.201025,part_4.json,4,72,20,im back,copyable message for your phone so you can ask me to paste the list when you message from the phone.,success,True,True,53,20
Account login recovery steps,account_login_recovery_steps,68f5ced0-e644-8320-836c-11dfd866dfaa,1760939750.156844,1760942864.181533,1760941307.1691885,This_is_normalized.1721.201025,part_4.json,4,9,1,I was doing the stuff that we were doing about removing the user profiles and I've been locked out o,"e access.  

Can you check your recovery key online and tell me when you’ve entered it successfully?",success,True,True,4,1
BitLocker recovery key steps,bitlocker_recovery_key_steps,68f5cff7-3974-8320-99f1-d5b609647ba8,1760940044.763136,1760942819.631418,1760941432.197277,This_is_normalized.1723.201025,part_4.json,4,109,37,Got it — your laptop is asking for the **BitLocker recovery key**. This happens when Windows detects,"(step 1 from above), or do you want me to restate the exact commands for your current prompt first?",success,True,True,84,37
Confirm account deletion,confirm_account_deletion,68f5c8ae-3b88-8322-af18-4d8c51202be4,1760938167.525045,1760939597.956744,1760938882.7408943,This_is_normalized.1641.201025,part_4.json,4,89,34,give me the command to confirm vodaN is deleted,ry corruption or shell handler issues remain before re-attempting the Notepad++ default association.,success,True,True,76,34
Fix desktop taskbar paths,fix_desktop_taskbar_paths,68f5c5e4-27b8-8321-ac29-630ddfa1bb2f,1760937473.053931,1760938116.117648,1760937794.5857894,This_is_normalized.1623.201025,part_4.json,4,31,13,Got it — the errors confirm your **user profile paths (like Desktop and Documents)** are broken or p,and sign back in once** — that refreshes the shell token and locks in the new profile context fully.,success,True,True,27,13
Memory checkpoint creation,memory_checkpoint_creation,68f5ad91-cc28-8320-9661-79d2009973a2,1760931233.38447,1760935618.016153,1760933425.7003117,This_is_normalized.1510.201025,part_4.json,4,75,23,Did you remember to create memory as im rebooting ?,d — I’ll now make sure information you ask to be sent between your phone and PC is shared both ways.,success,True,True,59,23
ChatGPT paid version benefits,chatgpt_paid_version_benefits,68f59dc5-7d44-8324-bea0-17e2eccec8ad,1760927189.879887,1760927332.539895,1760927261.209891,This_is_normalized.1327.201025,part_4.json,4,16,3,What are the benefits for the paid version of ChatGPT? How do I get it so you like remember everythi,"nything new. Over time, that’ll help me tailor responses more closely to your preferences and style.",success,True,True,9,3
Memory storage explanation,memory_storage_explanation,68f4a844-f000-8324-bec3-6a72199174e3,1760864337.155805,1760871093.832233,1760867715.494019,This_is_normalized.2055.191025,part_4.json,4,225,99,do you save memory of me and our conversations,"hat to click once it’s downloaded — line by line, so you don’t accidentally wipe anything important?",success,True,True,208,99
Example chat: Easy uploads,example_chat_easy_uploads,68f4a7cc-3f44-8320-9c49-1a6112c07287,1760864205.124704,1760864225.320851,1760864215.2227774,This_is_normalized.1956.191025,part_4.json,4,7,1,How could this resume be better?,"hanced bullet style)? It’ll show exactly how it could look in a stronger, two-page executive format.",success,True,True,4,1
Example chat: Ask anything,example_chat_ask_anything,68f4a7cb-8398-8323-86a3-305b9f7197af,1760864204.390524,1760864217.803513,1760864211.0970185,This_is_normalized.1956.191025,part_4.json,4,7,1,what are some recent innovative marketing examples?,"ies (tech, retail, entertainment, FMCG) and summarise what made each one work. Would that be useful?",success,True,True,3,1
