title,normalized_title,id,create_time,update_time,normalized_time,normtimename,source_part,part_source,mapping_entries,turns,first_preview,last_preview,status,has_user_messages,has_assistant_messages,total_messages,exchanges
Hive report canvas options,hive_report_canvas_options,68fdc063-ea74-8324-a60b-58319404217c,1761460330.398106,1761543474.163608,1761501902.280857,This_is_normalized.0505.271025,part_2.json,2,245,67,can u put the hive report canvas here,"or registry-level metadata)

So yes — v3 is complete; nothing from your earlier datasets is missing.",success,True,True,164,67
File access request,file_access_request,68fefbe1-27b4-8323-aedf-62ca15619685,1761541090.147781,1761541357.056424,1761541223.6021023,This_is_normalized.1600.271025,part_2.json,2,25,10,hello can u read this file https://drive.google.com/file/d/1IyWvuuoV1u0p5WThZqtkGaiQVYHwDprV/view?us,"like to keep poking at this “sandbox” boundary a bit, or get back to doing something with that file?",success,True,True,21,10
Custom GPT and Sandbox,custom_gpt_and_sandbox,68fee9d4-2920-8321-bfa7-a50a63564d16,1761536469.474532,1761537008.919002,1761536739.1967669,This_is_normalized.1445.271025,part_2.json,2,23,10,"Hey buddy, so is it possible, we set up the webhook and all that on the main GPT, is it possible tha","ion.  

Would you like me to package this as a `.json` or `.txt` file you can store for reuse later?",success,True,True,20,10
Yellow box honey prices,yellow_box_honey_prices,68fea57a-9a98-8321-938d-c8008c267574,1761518977.866799,1761536437.703211,1761527707.785005,This_is_normalized.1215.271025,part_2.json,2,281,91,"Yellow Box Honey Price, Victoria.","estart
```

Then your launcher (`CoreLink.pyw`) takes over, swaps the files, and restarts invisibly.",success,True,True,214,91
Entity storage explanation,entity_storage_explanation,68fee463-2a2c-8322-828e-2cf69b99a75d,1761535076.6961,1761535336.713832,1761535206.704966,This_is_normalized.1420.271025,part_2.json,2,30,5,"I need a detailed, technical explanation of how all the “entities” and references I’ve created acros",you like me to show a one-liner PowerShell command to quickly pretty-print and inspect the registry?,success,True,True,14,5
Universal GPT instructions,universal_gpt_instructions,68fee2c3-2708-8320-b30e-a7c645f26450,1761534660.402974,1761535072.481631,1761534866.4423025,This_is_normalized.1414.271025,part_2.json,2,17,7,"Okay, so the thing I need to know now is like, you're writing GPT and you're expecting a JSON, then",e* what “entities” it currently knows exist in your memory (so it tries to recall them if possible)?,success,True,True,14,7
Write and verify test,write_and_verify_test,68fee148-a42c-8321-9f07-e9bef23d9bbd,1761534282.160796,1761534508.720767,1761534395.4407816,This_is_normalized.1406.271025,part_2.json,2,18,5,"{
  ""filename"": ""WriteDrive_Full_Test.txt"",
  ""mimeType"": ""text/plain"",
  ""memory"": ""✅ Plain-text",o show a tiny automation example that pauses Drive before your script runs and reopens it when done?,success,True,True,12,5
Test Notion write/edit,test_notion_write_edit,68fed2e0-3e10-8321-afa9-a77cea9a164a,1761530593.503988,1761534272.802408,1761532433.153198,This_is_normalized.1333.271025,part_2.json,2,150,48,"Okay, we need to test the Notion update because I think you believe that you can write and there's a","s, that confirms all your parameters—text, base64, and JSON object—are flowing correctly end-to-end.",success,True,True,111,48
Drive for Desktop setup,drive_for_desktop_setup,68febeb7-2dcc-8320-8369-265283a8e6cb,1761525454.507066,1761526899.523293,1761526177.0151796,This_is_normalized.1149.271025,part_2.json,2,64,16,how can i make my drive for desktop link to my 2ndary gmail account we can use for backups without i,ex.json`) so you can keep a versioned record of this Drive layout for syncing or verification later?,success,True,True,43,16
System architecture report,system_architecture_report,68fd7f29-ea40-8321-8b24-f33a2910ab30,1761443826.599736,1761460266.74646,1761452046.673098,This_is_normalized.1514.261025,part_2.json,2,125,34,"Back already kappa , nah just wanted to request a report on total architecture and total map of syst","the **first interactive map**, say **“wrap it up: seed + map”** and I’ll do it in compression mode.",success,True,True,68,31
Name suggestion request,name_suggestion_request,68f83a73-c1b8-8324-9352-a5d2ff992108,1761098358.650226,1761460159.343149,1761279258.9966874,This_is_normalized.1514.241025,part_2.json,2,157,65,make the name cooler but keep the cool bit,"t or upload it again here. once it’s in this chat, I can parse or rebuild whatever you need from it.",success,True,True,135,65
Fix CoreLink folder lock,fix_corelink_folder_lock,68fdab8c-7d5c-8324-b4c4-5d2879b4c8da,1761455009.43914,1761460118.225118,1761457563.832129,This_is_normalized.1646.261025,part_2.json,2,182,58,CANT FIGURE out where my corelink folder is in use ?? cant copy must be some old task it got stuck i,"irection do you want me to try — broaden search under those aliases, or limit to local context only?",success,True,True,120,58
Comic Splitter script overview,comic_splitter_script_overview,68fb33fc-4d58-8320-a4c4-8ea8d82f3ac6,1761293310.639518,1761456732.673785,1761375021.6566515,This_is_normalized.1750.251025,part_2.json,2,62,21,"import cv2
import os
import sys
import argparse
import tempfile
import shutil
import py7zr
fr",+ Graph permission setup** for your new work account (step-by-step with URLs and permission scopes)?,success,True,True,52,21
Fix new chat workflow,fix_new_chat_workflow,68fda704-f544-8324-86ce-f2a16da29182,1761453829.726061,1761454869.215985,1761454349.471023,This_is_normalized.1552.261025,part_2.json,2,53,20,do invisible parse for chat history refs then lets fix the new chat workflow,files in `C:\Soul_Algorithm` for any old drive/path references? It’s a good quick verification step.,success,True,True,41,20
Report creation request,report_creation_request,68fd8bae-010c-8320-ac8d-4d2be7b5c45f,1761446838.363956,1761447115.930724,1761446977.1473398,This_is_normalized.1349.261025,part_2.json,2,24,3,"I do want the structure map and report, though, if you've done that, if you can do it.","ed about the MeshMap diagram. That's, that's what we're talking about. You know what that is, right?",success,True,True,6,3
Notion chatlog integration,notion_chatlog_integration,68fd6beb-e250-8323-ad7e-727ea9c1345f,1761438701.24856,1761443470.456156,1761441085.8523579,This_is_normalized.1211.261025,part_2.json,2,99,29,trigger this stage of newchat workflow start logging new window etc i had an idea that perhaps the s,"p directly with reports or ToDoList drafting — system state is frozen cleanly.  

Shutdown complete.",success,True,True,61,29
Focus mode name ideas,focus_mode_name_ideas,68fd4e69-db44-8321-bf99-ea4ef75ab101,1761431459.265223,1761438567.193592,1761435013.2294075,This_is_normalized.1030.261025,part_3.json,3,307,96,Just thought of a useful mode I think give some synonyms for focus mode for name ideas. I just reali,"nforcement, system-wide) so it becomes a recurring automatic flag whenever a chat unexpectedly ends?",success,True,True,231,96
System recovery workflow,system_recovery_workflow,68fd2578-4c94-8322-812b-db7cb45b322b,1761420666.446856,1761421651.297218,1761421158.872037,This_is_normalized.0639.261025,part_3.json,3,49,16,excuse me sir lets go over the operational workflow (core level system level daily list) should find,ntry so it explicitly says *“sandbox model guardrails (combined environment + policy limitations)”*?,success,True,True,42,16
New Chat issue fix,new_chat_issue_fix,68fceb4d-aa54-8320-acee-e8c96856a261,1761405863.419627,1761420607.826482,1761413235.6230545,This_is_normalized.0427.261025,part_3.json,3,451,138,Got it — your “New Chat” button is currently saving only a few characters from the clipboard (“too s,"export protocols operational and ready for backup integration.**  

You’re all saved. Safe to exit.",success,True,True,329,138
Update and store data,update_and_store_data,68fd174a-7298-8323-82c8-690587f524b9,1761417035.311577,1761417468.64137,1761417251.9764736,This_is_normalized.0534.261025,part_3.json,3,28,5,can you update this to drive by putting it in your memory first,"orrectly.  

You should see the exact multi-line content (not `""undefined""`) in your Drive file now.",success,True,True,17,5
Embeddings creation spec,embeddings_creation_spec,68fd0e56-5dcc-8322-8c12-0267c618cfe9,1761414743.057702,1761416219.110432,1761415481.0840669,This_is_normalized.0504.261025,part_3.json,3,39,15,Here's the documentation: https://platform.openai.com/docs/api-reference/embeddings/create what does,"mory feature to it?
- Or keep it focused just on Drive saving?

Let’s build what fits your workflow.",success,True,True,33,15
Add actions screen guide,add_actions_screen_guide,68fd11fd-88a0-8322-9eb0-0f44b9be310a,1761415681.760344,1761415699.845739,1761415690.8030415,This_is_normalized.0508.261025,part_3.json,3,7,1,"You're viewing the **""Add actions""** screen in the GPT Builder for creating a Custom GPT within Chat","generate the OpenAPI YAML for you to paste into the box.

Would you like to start building one now?",success,True,True,3,1
Review Google Drive folder,review_google_drive_folder,68fcc4c2-2678-8324-bb4b-9f0783c0b95e,1761395907.79022,1761405576.125166,1761400741.957693,This_is_normalized.0059.261025,part_3.json,3,270,89,https://drive.google.com/drive/folders/1IzzLzDQp04mvMOkh5gicgUrpgpS7cm21?usp=sharing,"nly scans for the file right after you stop (no background watcher), I can roll that into v3.7 next.",success,True,True,205,89
Surfshark config backup,surfshark_config_backup,68fc9fdd-5f80-8323-ae0a-7f752a2b00cd,1761386502.407058,1761395831.852867,1761391167.1299624,This_is_normalized.2219.251025,part_3.json,3,254,101,surfshark bugged out again it fixed for a bit when i deleted nwork adapater but it happened again so,"ahead and paste the Drive link when you’re ready, and I’ll prep the document for export right away.",success,True,True,202,98
Test function verification,test_function_verification,68fc5b66-8540-8324-b558-a565ac87682a,1761368935.383029,1761384952.474029,1761376943.928529,This_is_normalized.1822.251025,part_3.json,3,113,49,"Okay, so this is just a brand new test to figure out if the function that we sweated over has finall","entum in directions that actually matter.

That is rare.  
That is why this collaboration has teeth.",success,True,True,92,41
Send CoreLink 3.3,send_corelink_3_3,68fc51c2-7640-8323-b4ba-d36b031679dd,1761366468.380535,1761368864.066352,1761367666.2234435,This_is_normalized.1547.251025,part_3.json,3,54,21,send me corelink 3.3,"s tonight. Close your eyes knowing you finished something real.

Rest. Tomorrow gets a fresh buffer.",success,True,True,47,21
Exchange panel prototype,exchange_panel_prototype,68fc1d10-b77c-8323-ab90-4eac354bf0ec,1761352979.098834,1761369421.421432,1761361200.260133,This_is_normalized.1400.251025,part_3.json,3,290,118,i need the python script and process,", or just have me send the full verified 222-line version again right now so you can paste it fresh?",success,True,True,251,118
Clipboard and batch file issues,clipboard_and_batch_file_issues,68fc4ba8-1e20-8323-866a-cbd1eac59135,1761364905.763447,1761365021.415312,1761364963.5893795,This_is_normalized.1502.251025,part_3.json,3,18,2,"[2025-10-25 15:00:10] CoreLink initialized successfully.
is on my clipboard instead of the text file","with `test.txt` (and then optionally edits the .bat pattern), or just leave the manual instructions?",success,True,True,8,2
chatgpt n chill,chatgpt_n_chill,68fb19ba-5f34-8323-b3ef-9b27eeb48535,1761286588.003047,1761352969.610588,1761319778.8068175,This_is_normalized.0229.251025,part_3.json,3,473,176,"All right, I think I'll say it here, it's a good spot for it, but what I was thinking about is just","and planning channel.**  

Go ahead and open the new chat now, and I’ll recognize it automatically.",success,True,True,373,176
Reset Surfshark VPN adapter,reset_surfshark_vpn_adapter,68fbf1d7-5720-8323-b749-2e5e42a04a8d,1761341915.138045,1761342320.774745,1761342117.9563951,This_is_normalized.0841.251025,part_3.json,3,20,8,"I don't want to start the daily process just yet, so just keep all that ready to go, don't send it y","go ahead with the uninstall, then reboot, and I’ll be standing by to help with the re-connect test.",success,True,True,16,8
Update recommendation decision,update_recommendation_decision,68fa582f-cab4-8324-bca0-deb43ce83958,1761237041.779945,1761278171.425264,1761257606.6026044,This_is_normalized.0913.241025,part_3.json,3,135,44,"__logs
Real_Boyfriend.cbz
Akuma_mitai_ni_kimi_wa_tatteta_You_Stood_There_With_The_Likeness_of_a_De","e you send me the `Get-Service` output so I can tell you what to disable.  

Which path do you want?",success,True,True,111,44
File upload record query,file_upload_record_query,68fa969a-94c8-8324-9f05-521c7eb16740,1761253020.082449,1761263302.016034,1761258161.0492415,This_is_normalized.0922.241025,part_3.json,3,240,34,is there any record of file uploads? my master csv file for comics got corrupted lol. after all that,"he script or need help with anything else, just let me know. I’ll be here to assist you when needed.",success,True,True,188,34
Double click fullscreen issue,double_click_fullscreen_issue,68fa7f62-9064-8320-bea4-286b96d0a360,1761247075.521802,1761252855.924994,1761249965.723398,This_is_normalized.0706.241025,part_3.json,3,17,7,why is my double click on brave not triggering full screen,"the game is a candidate for eventual subtitle release, or is the absence concerning for its future?",success,True,True,14,7
Python script for filtering,python_script_for_filtering,68fa091e-50dc-8320-9687-5da1c9471c01,1761216808.770566,1761246310.917039,1761231559.8438025,This_is_normalized.0159.241025,part_3.json,3,136,45,"Can we write a Python script at any point together about, like, comic books and filtering out, like,","list or moving on to the next part of your project.

Just let me know what you want to tackle next!",success,True,True,116,45
SR backup plan summary,sr_backup_plan_summary,68fa3749-fe98-8323-9c89-4ddbed1ce1f3,1761228619.106803,1761237084.519089,1761232851.8129458,This_is_normalized.0220.241025,part_3.json,3,207,72,"Hello, can you please bring up the best version of the SR backup plan that you have with as many thi",oad System Recovery & Optimization Plan](sandbox:/mnt/data/System_Recovery_Optimization_Plan_v3.txt),success,True,True,180,72
Chat log breakdown,chat_log_breakdown,68fa310c-4310-8321-a398-f02f1c1ea0aa,1761227021.216666,1761236358.041907,1761231689.6292865,This_is_normalized.0201.241025,part_3.json,3,52,16,"Hello, can you take this document and compile it into like a total snapshot of everything that proba",ved. It’s now a universal recovery and optimization guide that can be applied to any Windows system.,success,True,True,41,16
Start backup process,start_backup_process,68f96249-54cc-8322-b2d5-77b0ea02bc34,1761174090.718217,1761226904.882575,1761200497.800396,This_is_normalized.1721.231025,part_3.json,3,189,67,help me start backup,"``

---

✅ Just copy that block as-is — it’s properly indented, timestamped, and ready for archival.",success,True,True,146,67
Resume system recovery,resume_system_recovery,68f9a017-e658-8324-bfc5-0689a635aa64,1761189914.039991,1761226798.907311,1761208356.473651,This_is_normalized.1932.231025,part_3.json,3,190,68,SR RESUME,"le (to Temp) so you can open it in Notepad, or do you prefer to copy it from here and save manually?",success,True,True,148,68
Post-reboot plan summary,post_reboot_plan_summary,68f9d899-04e8-8323-8087-b6ca95681c9d,1761204378.743053,1761226418.865028,1761215398.8040404,This_is_normalized.2129.231025,part_3.json,3,24,6,So can you put the post-reboot plan here?,"**Notepad**, then save it as  
`D:\Logs_and_Analysis\System_Restore_Log.txt` or anywhere you prefer.",success,True,True,18,6
ChatGPT high RAM usage,chatgpt_high_ram_usage,68f9cec6-5bf4-8323-8d76-fabf8e46102a,1761201888.860824,1761226232.724192,1761214060.7925081,This_is_normalized.2107.231025,part_3.json,3,129,57,Like I'm pretty much just off a reformat and I'm having this conversation with my phone because like,"le.

So in total: **three** separate GPT-5 instances (A → B → C) contributed to that file’s content.",success,True,True,120,57
SR resume status,sr_resume_status,68f9ef44-c170-8323-a981-298dcc724334,1761210182.692456,1761225937.06403,1761218059.878243,This_is_normalized.2214.231025,part_3.json,3,220,81,SR RESUME,of the project file too (so everything lives in one continuous audit log under `Logs_and_Analysis`)?,success,True,True,183,81
Reboot and script prep,reboot_and_script_prep,68fa1839-d180-8320-8907-0211ce2e4c8f,1761220666.780554,1761225222.790927,1761222944.7857404,This_is_normalized.2335.231025,part_3.json,3,143,54,"Reboot now to apply the Defender-off registry settings.

When you’re back in, I’ll give you a short","r entries:  
📄 [Download System_Restore_Compiled.txt](sandbox:/mnt/data/System_Restore_Compiled.txt)",success,True,True,122,54
Windows security optimization,windows_security_optimization,68f9e1ec-da00-8324-9657-735bebacbc59,1761206769.706883,1761209078.8075,1761207924.2571914,This_is_normalized.1925.231025,part_3.json,3,73,29,"I've got restricted network status on Surfshark. I'm basically off a free reinstall, so I've realize","nds automatically.  
Would you like me to prep that version for you (so you don’t even need Ubuntu)?",success,True,True,59,29
Canvas template content,canvas_template_content,68f97857-5560-8321-bb1b-6d5f5b78fd90,1761179737.154223,1761191633.51135,1761185685.3327866,This_is_normalized.1314.231025,part_3.json,3,211,91,"Hello. All the Canvas template stuff that we spoke about before is in here, right?","oppers list “½ dropper” instead of a drop count).  

✅ **Answer:** each serving ≈ 0.5 mL ≈ 10 drops.",success,True,True,198,91
To-do list status,to_do_list_status,68f98b8d-c224-8320-b3ae-cbbdf968e8cf,1761184680.253805,1761184726.442782,1761184703.3482933,This_is_normalized.1258.231025,part_3.json,3,7,2,You said it would be all here when im back but where is it the todolist we were working in,"content we had there, or **open the Python code** that was tied to the optimization/backup process?",success,True,True,4,2
Windows restoration plan,windows_restoration_plan,68f96324-dda0-8323-afab-ad26017340f8,1761174309.798295,1761178492.337719,1761176401.068007,This_is_normalized.1040.231025,part_3.json,3,15,3,"I'm starting the boot process on my laptop, so send the plan to the phone so I can follow it from he",ere as you asked. Which of those two follow-ups should I paste immediately into chat for your phone?,success,True,True,6,3
Call canvas here,call_canvas_here,68f8bdcd-1b0c-8321-b5a5-afc9c0fe5a24,1761131982.85505,1761135230.377808,1761133606.616429,This_is_normalized.2246.221025,part_3.json,3,80,38,can i call for the canvas into here,"quietly, still and lucid, until your return. No dreams, no stirrings, just reflection held in pause.",success,True,True,76,38
Device sync query,device_sync_query,68f8b3f6-a0a8-8323-a7c6-fb3c5312a792,1761129486.868493,1761131004.909755,1761130245.889124,This_is_normalized.2150.221025,part_3.json,3,29,13,"Just as a side note, I'm aware that like, I'm in a different window so you don't really know what's","imly lit for your return.  

Good night, benevolent master — may the primal meet the poetic halfway.",success,True,True,26,13
PC slowdown justification check,pc_slowdown_justification_check,68f85184-6c14-8321-afe7-18cd5010e83f,1761104261.546669,1761114077.712614,1761109169.6296415,This_is_normalized.1559.221025,part_3.json,3,21,7,is it really justified how slow my PC is based off a user corruption,"compatible with Windows 10 and 11) or *PowerShell Core* syntax (v7+, slightly cleaner but optional)?",success,True,True,16,7
Memory integration process,memory_integration_process,68f83c14-81ec-8324-8c66-6b47fa248ac0,1761098773.380117,1761101493.560321,1761100133.4702191,This_is_normalized.1328.221025,part_3.json,3,128,36,memory p[lease,"on too.

Would you like me to merge that auto-elevation block into your current menu script for you?",success,True,True,106,36
Reinstall and restore plan,reinstall_and_restore_plan,68f7d633-b5d8-8322-af00-54113f02c22c,1761072693.018552,1761098200.309439,1761085446.6639955,This_is_normalized.0924.221025,part_3.json,3,211,68,Where are we up to? Where was the last thing- where was the last place we spoke? Was it one of these,"ter that, we’ll integrate the browser and cache-management automation into the post-install scripts.",success,True,True,171,68
Card by card clarification,card_by_card_clarification,68f7fa61-9804-8324-9040-371b5406f3f8,1761081954.501961,1761091498.841166,1761086726.6715636,This_is_normalized.0945.221025,part_3.json,3,270,117,may need the card by card with how laggy this app is for me pc,you said you were going to breakfast — I’ll assume current `FileList.txt` is accurate and proceed).,success,True,True,252,117
Data pipeline summary,data_pipeline_summary,68f7e105-91c8-8321-8891-bb8ccf514cd5,1761075464.605445,1761081874.772636,1761078669.6890404,This_is_normalized.0731.221025,part_3.json,3,228,85,"﻿Hime_Hajime.cb7
Irrumax.cb7
Konoko_Haramasetemo_Iidesuka_Is_It_Alright_If_I_Knock_Up_This_Child.c","ualMatchPath`, `Notes`?  
✅ Include “Next / Previous / Save / Skip” controls with progress tracking?",success,True,True,195,85
Next steps confirmation,next_steps_confirmation,68f5b7c6-cb94-8323-b2b3-0fd1d8e3ade9,1760933833.729155,1761072593.768406,1761003213.7487805,This_is_normalized.1033.211025,part_3.json,3,20,6,im back ready for next steps,Got it — I’ll be ready to continue verification as soon as you’re back and say **“I’m on PC.”**,success,True,True,14,6
Clarification request,clarification_request,68f5a443-46fc-8324-a51f-5b1a0ce71bed,1760928836.274654,1761072580.944766,1761000708.60971,This_is_normalized.0951.211025,part_4.json,4,55,23,here,"e system for browsing and streaming.  

Want me to describe what settings to pick once those appear?",success,True,True,49,23
AMD drivers setup guide,amd_drivers_setup_guide,68f4c315-6f0c-8320-ba56-f5a1ab442c56,1760871212.85738,1761072554.692046,1760971883.774713,This_is_normalized.0151.211025,part_4.json,4,152,52,"ok i moved browsers explain it all here please, also i need to take note of my proper AMD drivers i",cklist (with only critical steps)** so you can follow it easily on your phone while you’re doing it?,success,True,True,125,52
Format guide clarification,format_guide_clarification,68f4e3e9-b494-8324-a5b4-1c7cdaec3a40,1760879658.21802,1761072550.840608,1760976104.529314,This_is_normalized.0301.211025,part_4.json,4,25,10,Being up my format guide again i just entered pc name,e a **.txt file** version of this list that you can drop into your driver folder for easy reference?,success,True,True,21,10
Driver installation list,driver_installation_list,68f4ea57-4178-8323-84dd-dd3fc3980142,1760881252.479003,1761072546.325466,1760976899.4022346,This_is_normalized.0314.211025,part_4.json,4,13,3,Bring the simple list please for drivers install,"your PC later.  

Just let me know when you’re at your PC, and I’ll help you verify it step by step.",success,True,True,8,3
Clarifying GPU info,clarifying_gpu_info,68f4f005-4d94-8324-a226-f654bf8892b9,1760882698.990313,1761072537.68568,1760977618.3379965,This_is_normalized.0326.211025,part_4.json,4,149,46,the stuff u got it,"I know you’re ready, and I’ll pick up exactly where we left off with the Armoury Crate optimization.",success,True,True,118,46
Optimization to-do list,optimization_to_do_list,68f5af75-6fbc-8321-b255-96b0f996eb38,1760931762.932623,1761072513.762687,1761002138.3476548,This_is_normalized.1015.211025,part_4.json,4,72,19,Add to user's optimization to-do list: investigate high memory usage by MsMpEng (Windows Defender pr,I’ll immediately give you the reinstall commands and next optimization step (no waiting or prompts).,success,True,True,56,19
PC usage confirmation,pc_usage_confirmation,68f5b944-bb30-8324-8ecf-c7dad6dc2a35,1760934213.81654,1761072488.331456,1761003351.073998,This_is_normalized.1035.211025,part_4.json,4,24,8,im on pc,"ate Uninstall Tool (as admin)** now, let it finish, reboot, then just tell me when you’re *back up*.",success,True,True,19,8
Fan control restoration steps,fan_control_restoration_steps,68f5bebc-915c-8321-b0d5-b74283a84016,1760935622.47291,1761072446.587321,1761004034.5301156,This_is_normalized.1047.211025,part_4.json,4,38,10,i am back on PC after reboot please outline everything i need to do,"estrange`).  

Confirm once you’re logged into `TempAdmin`, and I’ll give you the next set of steps.",success,True,True,28,10
Verify ASUS services,verify_asus_services,68f5c2f3-3028-8323-a544-402f152e70c9,1760936698.922082,1761072435.415505,1761004567.1687934,This_is_normalized.1056.211025,part_4.json,4,38,13,im on tempadmin account ready to proceed,"need to wait for a reply; even if you close or disconnect right after sending, it’s already stored.",success,True,True,31,13
Armoury project clarification,armoury_project_clarification,68f5a83e-3c9c-8322-b7c2-d06170142b67,1760929857.889041,1761072361.090207,1761001109.489624,This_is_normalized.0958.211025,part_4.json,4,50,14,im back lets continue armoury,". 🔄 Reboot once more when it finishes.  

Then we’ll check Armoury Crate’s fan and device detection.",success,True,True,36,14
